<?xml version="1.0" encoding="UTF-8" standalone="no"?>
<School xmlns:xsi="http://www.w3.org/2001/XMLSchema-instance" xsi:noNamespaceSchemaLocation="school.xsd">
    <Departments>
        <Department1 id="IT"/>
        <Department2 id="EL"/>
    </Departments>
    <Modules>
        <Module1 code="WebG" departments="IT">
            <ModuleName>Web-Grundlagen</ModuleName>
        </Module1>
        <Module2 code="OOP" departments="IT">
            <ModuleName>Objektoriente Programmierung</ModuleName>
        </Module2>
        <Module3 code="EL1" departments="IT EL">
            <ModuleName>Elektrotechnik I</ModuleName>
        </Module3>
    </Modules>
    <Lecturers>
        <Lecturer gender="m" modules="WebG OOP">
            <LastName>Keller</LastName>
            <FirstName>Peter</FirstName>
            <Street>Meine Strasse 3</Street>
            <ZIP>8001</ZIP>
            <City>Zurich</City>
            <AHVNumber>123.4567.8901.23</AHVNumber>
            <BirthDate>1982-01-01</BirthDate>
        </Lecturer>
    </Lecturers>
    <Students>
        <Student1 gender="m">
            <LastName>Meier</LastName>
            <FirstName>Hans</FirstName>
            <Street>Musterstrasse 3</Street>
            <ZIP>8001</ZIP>
            <City>Zurich</City>
            <AHVNumber>123.4567.8901.24</AHVNumber>
            <BirthDate>1990-01-01</BirthDate>
            <Exams>
                <Exam1 module="OOP" date="2016-01-01" grade="4"/>
                <Exam2 module="WebG" date="2016-01-02" grade="5"/>
            </Exams>
        </Student1>
        <Student2 gender="f">
            <LastName>MÃ¼ller</LastName>
            <FirstName>Doris</FirstName>
            <Street>Meine Strasse 4</Street>
            <ZIP>8001</ZIP>
            <City>Zurich</City>
            <AHVNumber>123.4567.8901.25</AHVNumber>
            <BirthDate>1990-01-02</BirthDate>
        </Student2>
    </Students>
</School>